{
  "correlation_id": "urn:grc:kr:csap:2026r1__kr:isms-p:2023r1",
  "source_catalog_id": "urn:grc:kr:csap:2026r1",
  "target_catalog_id": "urn:grc:kr:isms-p:2023r1",
  "schema_version": "v1",
  "mappings": [
    {
      "source_id": "urn:grc:kr:csap:2026r1:control:2.1.1",
      "target_id": "urn:grc:kr:isms-p:2023r1:control:2.2.3",
      "mapping_type": "PARTIAL",
      "provenance": "EXPERT_REVIEWED",
      "verification_status": "DRAFT",
      "evidence_ref": "KISA 클라우드서비스 보안인증제도 안내서(2025.02) 부록 C 보안인증기준 · 부록 D 인증평가 일부 생략의 범위",
      "rationale": "KISA 클라우드서비스 보안인증제도 안내서 부록 C에서 ISMS 인증 시 점검 대체 가능(★) 항목으로 지정됨. CSAP '고용계약'은 ISMS-P '보안 서약'과 통제 범위가 부분적으로 중첩된다.",
      "extensions": {
        "framework_meta": [],
        "tenant_meta": []
      }
    },
    {
      "source_id": "urn:grc:kr:csap:2026r1:control:2.1.3",
      "target_id": "urn:grc:kr:isms-p:2023r1:control:2.2.2",
      "mapping_type": "EQUIVALENT",
      "provenance": "EXPERT_REVIEWED",
      "verification_status": "DRAFT",
      "evidence_ref": "KISA 클라우드서비스 보안인증제도 안내서(2025.02) 부록 C 보안인증기준 · 부록 D 인증평가 일부 생략의 범위",
      "rationale": "KISA 클라우드서비스 보안인증제도 안내서 부록 C에서 ISMS 인증 시 점검 대체 가능(★) 항목으로 지정됨. CSAP '직무 분리'는 ISMS-P '직무 분리'와 통제 목적·요구사항이 실질적으로 동등하다.",
      "extensions": {
        "framework_meta": [],
        "tenant_meta": []
      }
    },
    {
      "source_id": "urn:grc:kr:csap:2026r1:control:2.1.4",
      "target_id": "urn:grc:kr:isms-p:2023r1:control:2.2.3",
      "mapping_type": "EQUIVALENT",
      "provenance": "EXPERT_REVIEWED",
      "verification_status": "DRAFT",
      "evidence_ref": "KISA 클라우드서비스 보안인증제도 안내서(2025.02) 부록 C 보안인증기준 · 부록 D 인증평가 일부 생략의 범위",
      "rationale": "KISA 클라우드서비스 보안인증제도 안내서 부록 C에서 ISMS 인증 시 점검 대체 가능(★) 항목으로 지정됨. CSAP '비밀유지서약서'는 ISMS-P '보안 서약'과 통제 목적·요구사항이 실질적으로 동등하다.",
      "extensions": {
        "framework_meta": [],
        "tenant_meta": []
      }
    },
    {
      "source_id": "urn:grc:kr:csap:2026r1:control:2.2.1",
      "target_id": "urn:grc:kr:isms-p:2023r1:control:2.3.2",
      "mapping_type": "EQUIVALENT",
      "provenance": "EXPERT_REVIEWED",
      "verification_status": "DRAFT",
      "evidence_ref": "KISA 클라우드서비스 보안인증제도 안내서(2025.02) 부록 C 보안인증기준 · 부록 D 인증평가 일부 생략의 범위",
      "rationale": "KISA 클라우드서비스 보안인증제도 안내서 부록 C에서 ISMS 인증 시 점검 대체 가능(★) 항목으로 지정됨. CSAP '외부인력 계약'은 ISMS-P '외부자 계약 시 보안'과 통제 목적·요구사항이 실질적으로 동등하다.",
      "extensions": {
        "framework_meta": [],
        "tenant_meta": []
      }
    },
    {
      "source_id": "urn:grc:kr:csap:2026r1:control:2.2.2",
      "target_id": "urn:grc:kr:isms-p:2023r1:control:2.3.3",
      "mapping_type": "EQUIVALENT",
      "provenance": "EXPERT_REVIEWED",
      "verification_status": "DRAFT",
      "evidence_ref": "KISA 클라우드서비스 보안인증제도 안내서(2025.02) 부록 C 보안인증기준 · 부록 D 인증평가 일부 생략의 범위",
      "rationale": "KISA 클라우드서비스 보안인증제도 안내서 부록 C에서 ISMS 인증 시 점검 대체 가능(★) 항목으로 지정됨. CSAP '외부인력 보안 이행 관리'는 ISMS-P '외부자 보안 이행 관리'와 통제 목적·요구사항이 실질적으로 동등하다.",
      "extensions": {
        "framework_meta": [],
        "tenant_meta": []
      }
    },
    {
      "source_id": "urn:grc:kr:csap:2026r1:control:2.2.3",
      "target_id": "urn:grc:kr:isms-p:2023r1:control:2.3.4",
      "mapping_type": "EQUIVALENT",
      "provenance": "EXPERT_REVIEWED",
      "verification_status": "DRAFT",
      "evidence_ref": "KISA 클라우드서비스 보안인증제도 안내서(2025.02) 부록 C 보안인증기준 · 부록 D 인증평가 일부 생략의 범위",
      "rationale": "KISA 클라우드서비스 보안인증제도 안내서 부록 C에서 ISMS 인증 시 점검 대체 가능(★) 항목으로 지정됨. CSAP '계약 만료 시 보안'은 ISMS-P '외부자 계약 변경 및 만료 시 보안'과 통제 목적·요구사항이 실질적으로 동등하다.",
      "extensions": {
        "framework_meta": [],
        "tenant_meta": []
      }
    },
    {
      "source_id": "urn:grc:kr:csap:2026r1:control:2.3.1",
      "target_id": "urn:grc:kr:isms-p:2023r1:control:2.2.4",
      "mapping_type": "SUBSET",
      "provenance": "EXPERT_REVIEWED",
      "verification_status": "DRAFT",
      "evidence_ref": "KISA 클라우드서비스 보안인증제도 안내서(2025.02) 부록 C 보안인증기준 · 부록 D 인증평가 일부 생략의 범위",
      "rationale": "KISA 클라우드서비스 보안인증제도 안내서 부록 C에서 ISMS 인증 시 점검 대체 가능(★) 항목으로 지정됨. CSAP '교육 프로그램 수립'은 ISMS-P '인식제고 및 교육훈련'가 포괄하는 요구사항의 일부에 해당한다.",
      "extensions": {
        "framework_meta": [],
        "tenant_meta": []
      }
    },
    {
      "source_id": "urn:grc:kr:csap:2026r1:control:2.3.2",
      "target_id": "urn:grc:kr:isms-p:2023r1:control:2.2.4",
      "mapping_type": "SUBSET",
      "provenance": "EXPERT_REVIEWED",
      "verification_status": "DRAFT",
      "evidence_ref": "KISA 클라우드서비스 보안인증제도 안내서(2025.02) 부록 C 보안인증기준 · 부록 D 인증평가 일부 생략의 범위",
      "rationale": "KISA 클라우드서비스 보안인증제도 안내서 부록 C에서 ISMS 인증 시 점검 대체 가능(★) 항목으로 지정됨. CSAP '교육 시행'은 ISMS-P '인식제고 및 교육훈련'가 포괄하는 요구사항의 일부에 해당한다.",
      "extensions": {
        "framework_meta": [],
        "tenant_meta": []
      }
    },
    {
      "source_id": "urn:grc:kr:csap:2026r1:control:2.3.3",
      "target_id": "urn:grc:kr:isms-p:2023r1:control:2.2.4",
      "mapping_type": "SUBSET",
      "provenance": "EXPERT_REVIEWED",
      "verification_status": "DRAFT",
      "evidence_ref": "KISA 클라우드서비스 보안인증제도 안내서(2025.02) 부록 C 보안인증기준 · 부록 D 인증평가 일부 생략의 범위",
      "rationale": "KISA 클라우드서비스 보안인증제도 안내서 부록 C에서 ISMS 인증 시 점검 대체 가능(★) 항목으로 지정됨. CSAP '평가 및 개선'은 ISMS-P '인식제고 및 교육훈련'가 포괄하는 요구사항의 일부에 해당한다.",
      "extensions": {
        "framework_meta": [],
        "tenant_meta": []
      }
    },
    {
      "source_id": "urn:grc:kr:csap:2026r1:control:3.1.1",
      "target_id": "urn:grc:kr:isms-p:2023r1:control:2.1.3",
      "mapping_type": "PARTIAL",
      "provenance": "EXPERT_REVIEWED",
      "verification_status": "DRAFT",
      "evidence_ref": "KISA 클라우드서비스 보안인증제도 안내서(2025.02) 부록 C 보안인증기준 · 부록 D 인증평가 일부 생략의 범위",
      "rationale": "KISA 클라우드서비스 보안인증제도 안내서 부록 C에서 ISMS 인증 시 점검 대체 가능(★) 항목으로 지정됨. CSAP '자산 식별'은 ISMS-P '정보자산 관리 / 정보자산 식별'과 통제 범위가 부분적으로 중첩된다.",
      "extensions": {
        "framework_meta": [],
        "tenant_meta": []
      }
    },
    {
      "source_id": "urn:grc:kr:csap:2026r1:control:3.1.1",
      "target_id": "urn:grc:kr:isms-p:2023r1:control:1.2.1",
      "mapping_type": "PARTIAL",
      "provenance": "EXPERT_REVIEWED",
      "verification_status": "DRAFT",
      "evidence_ref": "KISA 클라우드서비스 보안인증제도 안내서(2025.02) 부록 C 보안인증기준 · 부록 D 인증평가 일부 생략의 범위",
      "rationale": "KISA 클라우드서비스 보안인증제도 안내서 부록 C에서 ISMS 인증 시 점검 대체 가능(★) 항목으로 지정됨. CSAP '자산 식별'은 ISMS-P '정보자산 관리 / 정보자산 식별'과 통제 범위가 부분적으로 중첩된다.",
      "extensions": {
        "framework_meta": [],
        "tenant_meta": []
      }
    },
    {
      "source_id": "urn:grc:kr:csap:2026r1:control:3.1.2",
      "target_id": "urn:grc:kr:isms-p:2023r1:control:2.1.3",
      "mapping_type": "PARTIAL",
      "provenance": "EXPERT_REVIEWED",
      "verification_status": "DRAFT",
      "evidence_ref": "KISA 클라우드서비스 보안인증제도 안내서(2025.02) 부록 C 보안인증기준 · 부록 D 인증평가 일부 생략의 범위",
      "rationale": "KISA 클라우드서비스 보안인증제도 안내서 부록 C에서 ISMS 인증 시 점검 대체 가능(★) 항목으로 지정됨. CSAP '자산별 책임 할당'은 ISMS-P '정보자산 관리'와 통제 범위가 부분적으로 중첩된다.",
      "extensions": {
        "framework_meta": [],
        "tenant_meta": []
      }
    },
    {
      "source_id": "urn:grc:kr:csap:2026r1:control:3.1.3",
      "target_id": "urn:grc:kr:isms-p:2023r1:control:2.1.3",
      "mapping_type": "PARTIAL",
      "provenance": "EXPERT_REVIEWED",
      "verification_status": "DRAFT",
      "evidence_ref": "KISA 클라우드서비스 보안인증제도 안내서(2025.02) 부록 C 보안인증기준 · 부록 D 인증평가 일부 생략의 범위",
      "rationale": "KISA 클라우드서비스 보안인증제도 안내서 부록 C에서 ISMS 인증 시 점검 대체 가능(★) 항목으로 지정됨. CSAP '보안등급 및 취급'은 ISMS-P '정보자산 관리'와 통제 범위가 부분적으로 중첩된다.",
      "extensions": {
        "framework_meta": [],
        "tenant_meta": []
      }
    },
    {
      "source_id": "urn:grc:kr:csap:2026r1:control:5.1.1",
      "target_id": "urn:grc:kr:isms-p:2023r1:control:2.11.1",
      "mapping_type": "EQUIVALENT",
      "provenance": "EXPERT_REVIEWED",
      "verification_status": "DRAFT",
      "evidence_ref": "KISA 클라우드서비스 보안인증제도 안내서(2025.02) 부록 C 보안인증기준 · 부록 D 인증평가 일부 생략의 범위",
      "rationale": "KISA 클라우드서비스 보안인증제도 안내서 부록 C에서 ISMS 인증 시 점검 대체 가능(★) 항목으로 지정됨. CSAP '침해사고 대응 절차 수립'은 ISMS-P '사고 예방 및 대응체계 구축'과 통제 목적·요구사항이 실질적으로 동등하다.",
      "extensions": {
        "framework_meta": [],
        "tenant_meta": []
      }
    },
    {
      "source_id": "urn:grc:kr:csap:2026r1:control:5.1.2",
      "target_id": "urn:grc:kr:isms-p:2023r1:control:2.11.1",
      "mapping_type": "EQUIVALENT",
      "provenance": "EXPERT_REVIEWED",
      "verification_status": "DRAFT",
      "evidence_ref": "KISA 클라우드서비스 보안인증제도 안내서(2025.02) 부록 C 보안인증기준 · 부록 D 인증평가 일부 생략의 범위",
      "rationale": "KISA 클라우드서비스 보안인증제도 안내서 부록 C에서 ISMS 인증 시 점검 대체 가능(★) 항목으로 지정됨. CSAP '침해사고 대응 체계 구축'은 ISMS-P '사고 예방 및 대응체계 구축'과 통제 목적·요구사항이 실질적으로 동등하다.",
      "extensions": {
        "framework_meta": [],
        "tenant_meta": []
      }
    },
    {
      "source_id": "urn:grc:kr:csap:2026r1:control:5.2.1",
      "target_id": "urn:grc:kr:isms-p:2023r1:control:2.11.5",
      "mapping_type": "SUBSET",
      "provenance": "EXPERT_REVIEWED",
      "verification_status": "DRAFT",
      "evidence_ref": "KISA 클라우드서비스 보안인증제도 안내서(2025.02) 부록 C 보안인증기준 · 부록 D 인증평가 일부 생략의 범위",
      "rationale": "KISA 클라우드서비스 보안인증제도 안내서 부록 C에서 ISMS 인증 시 점검 대체 가능(★) 항목으로 지정됨. CSAP '침해사고 보고'는 ISMS-P '사고 대응 및 복구'가 포괄하는 요구사항의 일부에 해당한다.",
      "extensions": {
        "framework_meta": [],
        "tenant_meta": []
      }
    },
    {
      "source_id": "urn:grc:kr:csap:2026r1:control:5.2.2",
      "target_id": "urn:grc:kr:isms-p:2023r1:control:2.11.5",
      "mapping_type": "EQUIVALENT",
      "provenance": "EXPERT_REVIEWED",
      "verification_status": "DRAFT",
      "evidence_ref": "KISA 클라우드서비스 보안인증제도 안내서(2025.02) 부록 C 보안인증기준 · 부록 D 인증평가 일부 생략의 범위",
      "rationale": "KISA 클라우드서비스 보안인증제도 안내서 부록 C에서 ISMS 인증 시 점검 대체 가능(★) 항목으로 지정됨. CSAP '침해사고 처리 및 복구'는 ISMS-P '사고 대응 및 복구'와 통제 목적·요구사항이 실질적으로 동등하다.",
      "extensions": {
        "framework_meta": [],
        "tenant_meta": []
      }
    },
    {
      "source_id": "urn:grc:kr:csap:2026r1:control:5.3.1",